2000;Matthias Anlauff,Philipp W. Kutter,Alfonso Pierantonio,Asuman Sunbul;Using Domain-Specific Languages for the Realization of Component Composition.;112-126;15;Formally Engineering Systems;
2000;Gianna Reggio,Egidio Astesiano,Christine Choppy,Heinrich Hussmann;Analysing UML Active Classes and Associated State Machines - A Lightweight Formal Approach.;127-146;20;Software Engineering;
2000;Jose Hernandez-Orallo,Maria Jose Ramirez;Software as Learning: Quality Factors and Life-Cycle Revised.;147-162;16;Software Engineering;
2000;Hidetaka Kondoh;What Is `Mathematicalness' in Software Engineering?;163-177;15;Software Engineering;
2000;Alexander Egyed,Nenad Medvidovic;A Formal Approach to Heterogeneous Software Modeling.;178-192;15;Software Engineering;
2000;Gunnar Overgaard;Formal Specification of Object-Oriented Meta-modelling.;193-207;15;Object Orientation;
2000;Kees Huizing,Ruurd Kuiper;Verification of Object Oriented Programs Using Class Invariants.;208-221;14;Object Orientation;
2000;Pablo Gruer,Vincent Hilaire,Abderrafiaa Koukam;Verification of Object-Z Specifications by Using Transition Systems: Application to the Radiomobile Network Design Problem.;222-236;15;Object Orientation;
2000;Torsten Nelson,Donald D. Cowan,Paulo S. C. Alencar;A Model for Describing Object-Oriented Systems from Multiple Perspectives.;237-248;12;Object Orientation;
2000;Julia Padberg,Kathrin Hoffmann,Magdalena Gajewsky;Stepwise Introduction and Preservation of Safety Properties in Algebraic High-Level Net Systems.;249-265;17;Formallz Engineering Systems;
2000;Francoise Bellegarde-Webb,Jacques Julliand,Olga Kouchnarenko;Ready-Simulation Is Not Ready to Express a Modular Refinement Relation.;266-283;18;Theory and Applications;
2000;Marieke Huisman,Bart Jacobs;Java Program Verification via a Hoare Logic with Abrupt Termination.;284-303;20;Theory and Applications;
2000;Francesco Parisi-Presicce,Alexander L. Wolf;Foundations for Software Configuration Management Policies Using Graph Transformations.;304-318;15;Theory and Applications;
2000;Pascal Fradet,Valerie Issarny,Siegfried Rouvrais;Analyzing Non-functional Properties of Mobile Agents.;319-333;15;Theory and Applications;
2000;Heike Wehrheim;Specification of an Automatic Manufacturing System: A Case Study in Using Integrated Formal Methods.;334-348;15;Case Studies;
2000;Thomas Hune,Anders Sandholm;A Case Study on Using Automata in Control Synthesis.;349-362;14;Case Studies;
2000;Michael Balser,Wolfgang Reif,Gerhard Schellhorn,Kurt Stenzel,Andreas Thums;Formal System Development with KIV.;363-366;4;Demonstrations;
2000;Christoph Luth,Burkhart Wolff;More About TAS and IsaWin - Tools for Formal Program Development.;367-370;4;Demonstrations;
2000;Manuel Clavel,Francisco Duran,Steven Eker,Patrick Lincoln,Narciso Marti-Oliet,Jose Meseguer,Jose F. Quesada;Using Maude.;371-374;4;Demonstrations;
1999;Arie van Deursen,Paul Klint,Chris Verhoef;Research Issues in the Renovation of Legacy Systems.;1-21;21;Invited Tutorial;
1999;Herbert Weber;Continuous Engineering of Information and Communication Infrastructures (Extended Abstract).;22-29;8;Invited Paper;
1999;Davide Ancona,Maura Cerioli,Elena Zucca;A Formal Framework with Late Binding.;30-44;15;Contributed Papers;
1999;Candida Attanasio,Flavio Corradini,Paola Inverardi;Yet Another Real-Time Specification for the Steam Boiler: Local Clocks to Statically Measure Systems Performance.;45-59;15;Contributed Papers;
1999;Roberto Bruni,Jose Meseguer,Ugo Montanari;Executable Tile Specifications for Process Calculi.;60-76;17;Contributed Papers;
1999;Eva Coscia,Gianna Reggio;JTN: A Java-Targeted Graphic Formal Notation for Reactive and Concurrent Systems.;77-97;21;Contributed Papers;
1999;Wan Fokkink,Chris Verhoef;Conservative Extension in Positive/Negative Conditional Term Rewriting with Applications to Software Renovation Factories.;98-113;16;Contributed Papers;
1999;Marie-Claude Gaudel,Carole Khoury,Alexandre V. Zamulin;Dynamic Systems with Implicit State.;114-128;15;Contributed Papers;
1999;Kevin Lano,Andy Evans;Rigorous Development in UML.;129-144;16;Contributed Papers;
1999;Antonia Lopes,Jose Luiz Fiadeiro;Using Explicit State to Describe Architechtures.;144-160;17;Contributed Papers;
1999;Markus Muller-Olm,Bernhard Steffen,Rance Cleaveland;On the Evolution of Reactive Components: A Process-Algebraic Approach.;161-175;15;Contributed Papers;
1999;Valery A. Nepomniaschy;Verification of Definite Iteration over Hierarchical Data Structures.;176-187;12;Contributed Papers;
1999;Tobias Nipkow,Leonor Prensa Nieto;Owicki/Gries in Isabelle/HOL.;188-203;16;Contributed Papers;
1999;Chiara Nottegar,Corrado Priami,Pierpaolo Degano;Semantic-Driven Performance Evaluation (Extended Abstract).;204-218;15;Contributed Papers;
1999;Josef Tapken;Implementing Hierarchical Graph-Structures.;219-233;15;Contributed Papers;
1999;Lynne Blair,Trevor Jones,Gordon S. Blair;A Tool Suite for Multi-paradigm Specification.;234-238;5;Demos;
1999;Christoph Luth,Haykal Tej,Kolyang,Bernd Krieg-Bruckner;TAS and IsaWin: Tools for Transformational Program Development and Theorem Proving.;239-243;5;Demos;
1998;Kent Beck;Extreme Programming: A Humanistic Discipline of Software Development.;1-6;6;Invited Papers;
1998;Clifford B. Jones;Some Mistakes I Have and What I Have Learned from Them.;7-20;14;Invited Papers;
1998;Robert Allen,Remi Douence,David Garlan;Specifying and Analyzing Dynamic Software Architectures.;21-37;17;Contributed Papers;
1998;Narjes Berregeb,Adel Bouhoula,Michael Rusinowitch;Observational Proofs with Critical Contexts.;38-53;16;Contributed Papers;
1998;Steven Bradley,William Henderson,David Kendall,Adrian Robson;Integrating AORTA with Model-Based Data Specification Languages.;54-70;17;Contributed Papers;
1998;Robert Bussow,Robert Geisler,Marcus Klar;Specifying Safety-Critical Embedded Systems with Statecharts and Z: A Case Study.;71-87;17;Contributed Papers;
1998;Wolfgang Grieskamp,Maritta Heisel,Heiko Dorr;Specifying Embedded Systems with Staecharts and Z: An Agenda for Cyclic Software Components.;88-106;19;Contributed Papers;
1998;Martin Grosse-Rhode;Algebra Transformation Systems and their Composition.;107-122;16;Contributed Papers;
1998;Ali Hamie,John Howse,Stuart Kent;Navigation Expresion in Object-Oriented Modelling.;123-137;15;Contributed Papers;
1998;Reiko Heckel;Compositional Verification of Reactive Systems Specified by Graph Transformation.;138-153;16;Contributed Papers;
1998;Stefan Kahrs,Donald Sannella;Reflections on the Design of a Specification language.;154-170;17;Contributed Papers;
1998;Ulrike Lechner;Constructs, Concepts and Criteria for Reuse in Concurrent Object-Oriented languages.;171-187;17;Contributed Papers;
1998;Tiziana Margaria-Steffen,Bernhard Steffen;Backtracking-Free Design Planning by Automatic Synthesis in METAFrame.;188-204;17;Contributed Papers;
1998;Alexandre Mota,Augusto Sampaio;Model-Checking CSP-Z.;205-220;16;Contributed Papers;
1998;Julia Padberg,Magdalena Gajewsky,Claudia Ermel;Rule-Based Refinement of High-Level Nets Preserving Safety Properties.;221-238;18;Contributed Papers;
1998;Joy N. Reed,D. M. Jackson,B. Deianov,George M. Reed;Automated Formal Analysis of Networks: FDR Models of Arbitrary Topologies and Flow-Control Mechanisms.;239-254;16;Contributed Papers;
1998;Hanne Riis Nielson,Torben Amtoft Hansen,Flemming Nielson;Behaviour Analysis and Safety Conditions: A Case Study in CML.;255-269;15;Contributed Papers;
1998;Anders Sandholm,Michael I. Schwartzbach;Distributed Safety Controllers for Web Services.;270-284;15;Contributed Papers;
1998;Peter Scholz;A Refinement Calculus for Statecharts.;285-301;17;Contributed Papers;
1998;Bettina Sucrow;Refining Formal Specifications of Human Computer Interaction by Graph Rewrite Rules.;302-317;16;Demos;
1998;Ralf Behnke,Rudolf Berghammer,Erich Meyer,Peter Schneider;RELVIEW - A System for Calculating With Relations and Relational Programming.;318-321;4;Demos;
1998;Eric Dubois 0001;ALBERT: A Formal Language and Its Supporting Tools for Requirements Engineering.;322-325;4;Demos;
1998;Josef Tapken;MOBY/PLC - A Design Tool for Hierarchical Real-Time Automata.;326-329;4;Demos;
