2007;Marcin Stefaniak;Visualising exemplary program values.;575-578;4;Doctoral symposium;
2007;Irina Diana Coman;An analysis of developers' tasks using low-level, automatically collected data.;579-582;4;Doctoral symposium;
2007;Pasqualina Potena;Composition and tradeoff of non-functional attributes in software systems: research directions.;583-586;4;Doctoral symposium;
2007;Stefan Baerisch;Model-driven test-case construction.;587-590;4;Doctoral symposium;
2007;Youssef Hanna;SLEDE: lightweight verification of sensor network security protocol implementations.;591-594;4;Doctoral symposium;
2007;Madeline Diep;Analysis of a deployed software.;595-598;4;Doctoral symposium;
2007;Roberto Pietrantuono;Component airbag: a novel approach to develop dependable component-based applications.;599-602;4;Doctoral symposium;
2007;Sevan Kavaldjian;A model-driven approach to generating user interfaces.;603-606;4;Doctoral symposium;
2007;Farhad Arbab,Christel Baier;Syanco 2007: international workshop on synthesis and analysis of component connectors.;607-608;2;Workshops summaries;
2007;Jonathan Aldrich,Michael Barnett,Dimitra Giannakopoulou,Gary T. Leavens,Natasha Sharygina;Specification and verification of component-based systems 2007.;609-610;2;Workshops summaries;
2007;Massimiliano Di Penta,Michele Lanza;IWPSE 2007: 9th international workshop on principles of software evolution.;611-612;2;Workshops summaries;
2007;Elisabetta Di Nitto,Andrea Polini,Andrea Zisman;2nd international workshop on service oriented software engineering (IW-SOSWE 2007).;613-614;2;Workshops summaries;
2007;Giovanni Denaro,Mauro Pezze,Onn Shehory;SOQUA 2007: 4th international workshop on software quality assurance.;615-616;2;Workshops summaries;
2007;Nicolas Guelfi,Henry Muccini,Patrizio Pelliccione,Alexander Romanovsky;EFTS 2007: the 2nd international workshop on engineering fault tolerant systems.;617-618;2;Workshops summaries;
2007;Alexander L. Wolf;Engineering software services for pervasive environments.;619-620;2;Workshops summaries;
2007;Alan Hartman,Mika Katara,Amit M. Paradkar;Domain specific approaches to software test automation.;621-622;2;Workshops summaries;
2007;Mehdi Jazayeri,David S. Rosenblum;Foreword to state-of-the-art presentations.;437;1;State-of-the-art presentations;
2007;Fernando Silva Parreiras,Steffen Staab,Andreas Winter;On marrying ontological and metamodeling technical spaces.;439-448;10;State-of-the-art presentations;
2007;Marta Z. Kwiatkowska;Quantitative verification: models, techniques and tools.;449-458;10;State-of-the-art presentations;
2007;Walt Scacchi;Free/open source software development: recent research results and emerging opportunities.;459-468;10;State-of-the-art presentations;
2007;Antonia Bertolino,Henry Muccini;Welcome to the WISE track.;469;1;Widened software engineering;
2007;Manzil e Maqsood,Talha Javed;Practicum in software project management: an endeavor to effective and pragmatic software project management education.;471-479;9;Widened software engineering;
2007;Asim El-Sheikh,Haroon Tarawneh;A survey of web engineering practice in small Jordanian web development firms.;481-489;9;Widened software engineering;
2007;Roumen Nikolov,Sylvia Ilieva;Building a research university ecosystem: the case of software engineering education at Sofia University.;491-500;10;Widened software engineering;
2007;Helen Sharp,Tracy Hall,Nathan Baddoo,Sarah Beecham;Exploring motivational differences between software developers and project managers.;501-504;4;ESEC/FSE'07 posters;
2007;Stig Larsson,Petri Myllyperkio,Fredrik Ekdahl;Product integration improvement based on analysis of build statistics.;505-508;4;ESEC/FSE'07 posters;
2007;Mikael Patel,Andreas Borg,Kristian Sandahl;A case study in assessing and improving capacity using an anatomy of good practice.;509-512;4;ESEC/FSE'07 posters;
2007;Hamid Abdul Basit,Simon J. Puglisi,William F. Smyth,Andrew Turpin,Stanislaw Jarzabek;Efficient token based clone detection with flexible tokenization.;513-516;4;ESEC/FSE'07 posters;
2007;Xin Zhou,Ying Liu,Jun Zhu;A segment-based approach for reconcilable model transformation.;517-520;4;ESEC/FSE'07 posters;
2007;Alessandro Fantechi,Stefania Gnesi;A behavioural model for product families.;521-524;4;ESEC/FSE'07 posters;
2007;Engin Uzuncaova,Daniel Garcia,Sarfraz Khurshid,Don S. Batory;A specification-based approach to testing software product lines.;525-528;4;ESEC/FSE'07 posters;
2007;Tushar Kumar,Jaswanth Sreeram,Romain Cledat,Santosh Pande;A profile-driven statistical analysis framework for the design optimization of soft real-time applications.;529-532;4;ESEC/FSE'07 posters;
2007;Shan Lu,Weihang Jiang,Yuanyuan Zhou;A study of interleaving coverage criteria.;533-536;4;ESEC/FSE'07 posters;
2007;Andriy V. Miranskyy,Nazim H. Madhavji,Mechelle Gittens,Matthew Davison,Mark Wilding,David Godwin;An iterative, multi-level, and scalable approach to comparing execution traces.;537-540;4;ESEC/FSE'07 posters;
2007;Ken Koster,David Kao;State coverage: a structural test adequacy criterion for behavior checking.;541-544;4;ESEC/FSE'07 posters;
2007;Trishul M. Chilimbi,Aditya V. Nori,Kapil Vaswani;Quantifying the effectiveness of testing via efficient residual path profiling.;545-548;4;ESEC/FSE'07 posters;
2007;Robert B. Evans,Alberto Savoia;Differential testing: a new approach to change detection.;549-552;4;ESEC/FSE'07 posters;
2007;Rupak Majumdar,Ru-Gang Xu;Directed test generation using symbolic grammars.;553-556;4;ESEC/FSE'07 posters;
2007;Sandro Fouche,Myra B. Cohen,Adam A. Porter;Towards incremental adaptive covering arrays.;557-560;4;ESEC/FSE'07 posters;
2007;Pallavi Joshi,Koushik Sen,Mark Shlimovich;Predictive testing: amplifying the effectiveness of software testing.;561-564;4;ESEC/FSE'07 posters;
2007;Mark Sherriff,Sarah Smith Heckman,J. Michael Lake,Laurie Williams;Using groupings of static analysis alerts to identify files likely to contain field failures.;565-568;4;ESEC/FSE'07 posters;
2007;Chang Xu,Shing-Chi Cheung,Wing Kwong Chan,Chunyang Ye;On impact-oriented automatic resolution of pervasive context inconsistency.;569-572;4;ESEC/FSE'07 posters;
2007;Carlo Ghezzi;Foreword to the doctoral symposium.;573;1;Doctoral symposium;
2007;Marcin Stefaniak;Visualising exemplary program values.;575-578;4;Doctoral symposium;
2007;Irina Diana Coman;An analysis of developers' tasks using low-level, automatically collected data.;579-582;4;Doctoral symposium;
2007;Pasqualina Potena;Composition and tradeoff of non-functional attributes in software systems: research directions.;583-586;4;Doctoral symposium;
2007;Stefan Baerisch;Model-driven test-case construction.;587-590;4;Doctoral symposium;
2007;Youssef Hanna;SLEDE: lightweight verification of sensor network security protocol implementations.;591-594;4;Doctoral symposium;
2007;Madeline Diep;Analysis of a deployed software.;595-598;4;Doctoral symposium;
2007;Roberto Pietrantuono;Component airbag: a novel approach to develop dependable component-based applications.;599-601;3;Doctoral symposium;
2007;Sevan Kavaldjian;A model-driven approach to generating user interfaces.;603-606;4;Doctoral symposium;
2007;Farhad Arbab,Christel Baier;SYANCO 2007: international workshop on synthesis and analysis of component connectors.;607-608;2;Workshops summaries;
2007;Jonathan Aldrich,Gary T. Leavens,Michael Barnett,Natasha Sharygina,Dimitra Giannakopoulou;Specification and verification of component-based systems 2007.;609-610;2;Workshops summaries;
2007;Massimiliano Di Penta,Michele Lanza;IWPSE 2007: 9th international workshop on principles of software evolution.;611-612;2;Workshops summaries;
2007;Elisabetta Di Nitto,Andrea Polini,Andrea Zisman;2nd international workshop on service oriented software engineering: (IW-SOSWE 2007).;613-614;2;Workshops summaries;
2007;Giovanni Denaro,Mauro Pezze,Onn Shehory;SOQUA 2007 4th international workshop on software quality assurance.;615-616;2;Workshops summaries;
2007;Nicolas Guelfi,Henry Muccini,Patrizio Pelliccione,Alexander Romanovsky;EFTS 2007: the 2nd international workshop on engineering fault tolerant systems.;617-618;2;Workshops summaries;
2007;Alexander L. Wolf;Engineering software services for pervasive environments: ESSPE '07 workshop summary.;619-620;2;Workshops summaries;
2007;Alan Hartman,Mika Katara,Amit M. Paradkar;Domain specific approaches to software test automation.;621-622;2;Workshops summaries;
2006;Mik Kersten,Gail C. Murphy;Using task context to improve programmer productivity.;1-11;11;Empirical methods and program understanding;
2006;T. H. Ng,Shing-Chi Cheung,Wing Kwong Chan,Y. T. Yu;Work experience versus refactoring to design patterns: a controlled experiment.;12-22;11;Empirical methods and program understanding;
2006;Jonathan Sillito,Gail C. Murphy,Kris De Volder;Questions programmers ask during software evolution tasks.;23-34;12;Empirical methods and program understanding;
2006;Sunghun Kim,Kai Pan,Jim Whitehead;Memories of bug fixes.;35-45;11;Mining failures and bugs;
2006;Chao Liu 0001,Jiawei Han;Failure proximity: a fault localization-based approach.;46-56;11;Mining failures and bugs;
2006;Maximilian Storzer,Barbara G. Ryder,Xiaoxia Ren,Frank Tip;Finding failure-inducing changes in java programs using change classification.;57-68;12;Mining failures and bugs;
2006;Brian Hackett,Alexander Aiken;How is aliasing used in systems software?;69-80;12;Program analysis;
2006;Xiangyu Zhang,Sriraman Tallam,Rajiv Gupta;Dynamic slicing long running programs through execution fast forwarding.;81-91;11;Program analysis;
2006;Matthew B. Dwyer,Suzette Person,Sebastian G. Elbaum;Controlling factors in evaluating path-sensitive error detection techniques.;92-104;13;Program analysis;
2006;Deepak Kapur,Rupak Majumdar,Calogero G. Zarba;Interpolation for data structures.;105-116;12;Formal approaches to programming;
2006;Bhargav S. Gulavani,Thomas A. Henzinger,Yamini Kannan,Aditya V. Nori,Sriram K. Rajamani;SYNERGY: a new algorithm for property checking.;117-127;11;Formal approaches to programming;
2006;Ranjit Jhala,Rupak Majumdar;Bit level types for high level reasoning.;128-140;13;Formal approaches to programming;
2006;Hyunsook Do,Gregg Rothermel;An empirical study of regression testing techniques incorporating context and lifetime factors and improved cost-benefit models.;141-151;11;Empirical studies;
2006;Fernando Castor Filho,Nelio Cacho,Eduardo Magno Lages Figueiredo,Raquel Maranhao,Alessandro Garcia,Cecilia Mary Fischer Rubira;Exceptions and aspects: the devil is in the details.;152-162;11;Empirical studies;
2006;Olivier Giroux,Martin P. Robillard;Detecting increases in feature coupling using regression tests.;163-174;12;Empirical studies;
2006;William G. J. Halfond,Alessandro Orso,Pete Manolios;Using positive tainting and syntax-aware evaluation to counter SQL injection attacks.;175-185;11;Safety and security;
2006;Chunyang Ye,Shing-Chi Cheung,Wing Kwong Chan,Chang Xu;Local analysis of atomicity sphere for B2B collaboration.;186-196;11;Safety and security;
2006;Christophe Damas,Bernard Lambeau,Axel van Lamsweerde;Scenarios, goals, and state machines: a win-win partnership for model synthesis.;197-207;11;Requirements modeling;
2006;Rachel L. Cobleigh,George S. Avrunin,Lori A. Clarke;User guidance for creating precise and accessible property specifications.;208-218;11;Requirements modeling;
2006;Shahar Maoz,David Harel;From multi-modal scenarios to code: compiling LSCs into aspectJ.;219-230;12;Requirements modeling;
2006;Matthew J. Rutherford,Antonio Carzaniga,Alexander L. Wolf;Simulation-based test adequacy criteria for distributed systems.;231-241;11;Testing;
2006;Heng Lu 0001,Wing Kwong Chan,T. H. Tse;Testing context-aware middleware-centric programs: a data flow approach and an RFID-based experimentation.;242-252;11;Testing;
2006;Sebastian G. Elbaum,Hui Nee Chin,Matthew B. Dwyer,Jonathan Dokulil;Carving differential unit test cases from system test cases.;253-264;12;Testing;
2006;David Lo,Siau-Cheng Khoo;SMArTIC: towards building an accurate, robust and scalable specification miner.;265-275;11;Specification mining;
2006;Mana Taghdiri,Robert Seater,Daniel Jackson;Lightweight extraction of syntactic specifications.;276-286;11;Specification mining;
2005;Oscar Nierstrasz,Stephane Ducasse,Tudor Girba;The story of moose: an agile reengineering environment.;1-10;10;;
2005;Martin P. Robillard;Automatic generation of suggestions for program investigation.;11-20;10;Software change analysis;
2005;Bill McCloskey,Eric A. Brewer;ASTEC: a new approach to refactoring C.;21-30;10;Software change analysis;
2005;Thomas A. Henzinger,Ranjit Jhala,Rupak Majumdar;Permissive interfaces.;31-40;10;Software change analysis;
2005;Renaud De Landtsheer,Axel van Lamsweerde;Reasoning about confidentiality at requirements engineering time.;41-49;9;Requirements;
2005;Paul Baker,Paul Bristow,Clive Jervis,David J. King,Robert Thomson,Bill Mitchell,Simon Burton;Detecting and resolving semantic pathologies in UML sequence diagrams.;50-59;10;Requirements;
2005;Matthias Heindl,Stefan Biffl;A case study on value-based requirements tracing.;60-69;10;Requirements;
2005;Emmanuel Letier,Jeffrey Kramer,Jeff N. Magee,Sebastian Uchitel;Fluent temporal logic for discrete-time event-based models.;70-79;10;Models and components;
2005;Junrong Shen,Xi Sun,Gang Huang 0001,Wenpin Jiao,Yanchun Sun,Hong Mei;Towards a unified formal model for supporting mechanisms of dynamic component update.;80-89;10;Models and components;
2005;Manos Renieris,Shashank Ramaprasad,Steven P. Reiss;Arithmetic program paths.;90-98;9;Models and components;
2005;Stephane Ducasse,Tudor Girba,Oscar Nierstrasz;Moose: an agile reengineering environment.;99-102;4;Research tool demonstrations I;
2005;Bradley R. Schmerl,David Garlan,Hong Yan;Dynamically discovering architectures with DiscoTect.;103-106;4;Research tool demonstrations I;
2005;Jacek Sliwerski,Thomas Zimmermann,Andreas Zeller;HATARI: raising risk awareness.;107-110;4;Research tool demonstrations I;
2005;Paola Inverardi,Henry Muccini,Patrizio Pelliccione;CHARMY: an extensible tool for architectural analysis.;111-114;4;Research tool demonstrations I;
2005;Yichen Xie,Alexander Aiken;Context- and path-sensitive memory leak detection.;115-125;11;Application performance;
2005;Edu Metz,Raimondas Lencevicius,Teofilo F. Gonzalez;Performance data collection using a hybrid approach.;126-135;10;Application performance;
2005;Kavitha Srinivas,Harini Srinivasan;Summarizing application performance from a components perspective.;136-145;10;Application performance;
2005;Murali Haran,Alan F. Karr,Alessandro Orso,Adam A. Porter,Ashish P. Sanil;Applying classification techniques to remotely-collected program execution data.;146-155;10;Patterns and aspects;
2005;Hamid Abdul Basit,Stanislaw Jarzabek;Detecting higher-level similarity patterns in programs.;156-165;10;Patterns and aspects;
2005;Kevin J. Sullivan,William G. Griswold,Yuanyuan Song,Yuanfang Cai,Macneil Shonle,Nishit Tewari,Hridesh Rajan;Information hiding interfaces for aspect-oriented design.;166-175;10;Patterns and aspects;
2005;Antonio S. Camara;Innovations in pervasive computing.;176;1;;
2005;Jennifer Bevan,Jim Whitehead,Sunghun Kim,Michael W. Godfrey;Facilitating software evolution research with kenyon.;177-186;10;Software evolution analysis;
2005;Miryung Kim,Vibha Sazawal,David Notkin,Gail C. Murphy;An empirical study of code clone genealogies.;187-196;10;Software evolution analysis;
2005;Xiangyu Zhang,Rajiv Gupta;Matching execution histories of program versions.;197-206;10;Software evolution analysis;
2005;Viktor Kuncak,Daniel Jackson;Relational analysis of algebraic datatypes.;207-216;10;Objects and datatypes;
2005;Kevin Bierhoff,Jonathan Aldrich;Lightweight object specification with typestates.;217-226;10;Objects and datatypes;
2005;Jeffrey Fischer,Ranjit Jhala,Rupak Majumdar;Joining dataflow with predicates.;227-236;10;Objects and datatypes;
2005;Reid Holmes,Robert J. Walker,Gail C. Murphy;Strathcona example recommendation tool.;237-240;4;Research tool demonstrations II;
2005;Nikolai Tillmann,Wolfram Schulte;Parameterized unit tests with unit meister.;241-244;4;Research tool demonstrations II;
2005;Robert Chatley,Thomas Timbul;KenyaEclipse: learning to program in eclipse.;245-248;4;Research tool demonstrations II;
2005;Pavel Grigorenko,Ando Saabas,Enn Tyugu;Visual tool for generative programming.;249-252;4;Research tool demonstrations II;
2005;Nikolai Tillmann,Wolfram Schulte;Parameterized unit tests.;253-262;10;Testing;
2005;Koushik Sen,Darko Marinov,Gul Agha;CUTE: a concolic unit testing engine for C.;263-272;10;Testing;
2005;Margus Veanes,Colin Campbell,Wolfram Schulte,Nikolai Tillmann;Online testing with model programs.;273-282;10;Testing;
2005;Jeffrey Kramer,Jeff N. Magee;Engineering distributed software: a structural discipline.;283-285;3;;
2005;Chao Liu 0001,Xifeng Yan,Long Fei,Jiawei Han,Samuel P. Midkiff;SOBER: statistical model-based bug localization.;286-295;10;Bug localization;
2005;V. Benjamin Livshits,Thomas Zimmermann;DynaMine: finding common error patterns by mining software revision histories.;296-305;10;Bug localization;
2005;Zhenmin Li,Yuanyuan Zhou;PR-Miner: automatically extracting implicit programming rules and detecting violations in large software code.;306-315;10;Bug localization;
2005;Jacky Estublier,German Vega;Reuse and variability in large software applications.;316-325;10;Product lines and middleware;
2005;Ulf Pettersson,Stanislaw Jarzabek;Industrial experience with building a web portal product line using a lightweight, reactive approach.;326-335;10;Product lines and middleware;
2005;Chang Xu,Shing-Chi Cheung;Inconsistency detection and resolution for context-aware middleware support.;336-345;10;Product lines and middleware;
2005;Jorge Aranda,Steve M. Easterbrook;Anchoring and adjustment in software estimation.;346-355;10;Effort estimation;
2005;Lorin Hochstein,Victor R. Basili,Marvin V. Zelkowitz,Jeffrey K. Hollingsworth,Jeffrey Carver;Combining self-reported and automatic data to improve programming effort measurement.;356-365;10;Effort estimation;
2005;Aline Lucia Baroni;Quantitative assessment of UML dynamic models.;366-369;4;Doctoral symposium;
2005;Andrew Le Gear,Jim Buckley;"Reengineering towards components using ""Reconn-exion"".";370-373;4;Doctoral symposium;
2005;Ivonne Erfurth,Wilhelm Rossak;UPEX: user participation by example.;374-376;3;Doctoral symposium;
2005;Marco Antonio Barbosa;A refinement calculus for software components and architectures.;377-380;4;Doctoral symposium;
2005;Mark Sherriff;Utilizing verification and validation certificates to estimate software defect density.;381-384;4;Doctoral symposium;
2005;Wiebe Hordijk,Roel Wieringa;Surveying the factors that influence maintainability: research design.;385-388;4;Doctoral symposium;
2004;Alexander L. Wolf;Is security engineering really just good software engineering?;1;1;Program analysis;
2004;Alexander Egyed;Resolving uncertainties during trace analysis.;3-12;10;Program analysis;
2004;Jurgen Dingel,Hongzhi Liang;Automating comprehensive safety analysis of concurrent programs using verisoft and TXL.;13-22;10;Program analysis;
2004;Jeff H. Perkins,Michael D. Ernst;Efficient incremental algorithms for dynamic detection of likely invariants.;23-32;10;Program analysis;
2004;Sebastian Uchitel,Robert Chatley,Jeffrey Kramer,Jeff N. Magee;System architecture: the context for scenario-based model synthesis.;33-42;10;Modeling and requirements;
2004;Sebastian Uchitel,Marsha Chechik;Merging partial behavioural models.;43-52;10;Modeling and requirements;
2004;Emmanuel Letier,Axel van Lamsweerde;Reasoning about partial goal satisfaction for requirements and design engineering.;53-62;10;Modeling and requirements;
2004;Roman Manevich,Manu Sridharan,Stephen Adams,Manuvir Das,Zhe Yang;PSE: explaining program failures via postmortem static analysis.;63-72;10;Error explanation;
2004;Sagar Chaki,Alex Groce,Ofer Strichman;Explaining abstract counterexamples.;73-82;10;Error explanation;
2004;Ted Kremenek,Ken Ashcraft,Junfeng Yang,Dawson R. Engler;Correlation exploitation in error ranking.;83-93;11;Error explanation;
2004;Joe Marks;The usability problem for home appliances: engineers caused it, engineers can fix it!;95;1;Error explanation;
2004;Misha Zitser,Richard P. Lippmann,Tim Leek;Testing static analysis tools using exploitable buffer overflows from open source code.;97-106;10;Safety and security;
2004;Licia Capra;Engineering human trust in mobile system collaborations.;107-116;10;Safety and security;
2004;Wei Xu,Daniel C. DuVarney,R. Sekar;An efficient and backwards-compatible transformation to ensure memory safety of C programs.;117-126;10;Safety and security;
2004;Mira Mezini,Klaus Ostermann;Variability management with feature-oriented programming and aspects.;127-136;10;Aspects;
2004;Shriram Krishnamurthi,Kathi Fisler,Michael Greenberg;Verifying aspect advice modularly.;137-146;10;Aspects;
2004;Martin C. Rinard,Alexandru Salcianu,Suhabe Bugrara;A classification system and analysis for aspect-oriented programs.;147-158;12;Aspects;
2004;Robert J. Walker,Kevin Viggers;Implementing protocols via declarative event patterns.;159-169;11;Aspects;
2004;Nancy G. Leveson,Kathryn Anne Weiss;Making embedded software reuse practical and safe.;171-178;8;Aspects;
2004;Holger Giese,Sven Burmester,Wilhelm Schafer,Oliver Oberschelp;Modular design and verification of component-based mechatronic systems with online-reconfiguration.;179-188;10;Verification;
2004;Jonathan Edwards,Daniel Jackson,Emina Torlak;A type system for object models.;189-199;11;Verification;
2004;Jianbin Tan,George S. Avrunin,Lori A. Clarke,Shlomo Zilberstein,Stefan Leue;Heuristic-guided counterexample search in FLAVERS.;201-210;10;Verification;
2004;Ying Pan,Lei Wang,Lu Zhang 0023,Bing Xie,Fuqing Yang;Relevancy based semantic interoperation of reuse repositories.;211-220;10;Development support;
2004;Cleidson Ronald Botelho de Souza,David F. Redmiles,Li-Te Cheng,David R. Millen,John F. Patterson;How a good software practice thwarts collaboration: the multiple roles of APIs in software development.;221-230;10;Development support;
2004;Xiaofang Zhang,Michal Young,John Howard Eli Fiskio-Lasseter;Refining code-design mapping with flow analysis.;231-240;10;Development support;
2004;Alessandro Orso,Nanjuan Shi,Mary Jean Harrold;Scaling regression testing to large software systems.;241-251;11;Testing and reliability;
2004;Maria Jose Suarez Cabal,Javier Tuya;Using an SQL coverage measurement for testing database applications.;253-262;10;Testing and reliability;
2004;Paul Luo Li,Mary Shaw,James D. Herbsleb,Bonnie K. Ray,Peter Santhanam;Empirical evaluation of defect projection models for widely-deployed production software systems.;263-272;10;Testing and reliability;
2003;Giuseppe Longo;Computer modelling and natural phenomena.;1-5;5;;
2003;Leon J. Osterweil;Understanding process and the quest for deeper questions in software engineering research.;6-14;9;;
2003;Ari Jaaksi;Assessing software projects: tools for business owners.;15-18;4;;
2003;Sebastian Uchitel,Jeffrey Kramer,Jeff N. Magee;Behaviour model elaboration using partial labelled transition systems.;19-27;9;Requirements engineering and design;
2003;Ralph D. Jeffords,Constance L. Heitmeyer;A strategy for efficiently verifying requirements.;28-37;10;Requirements engineering and design;
2003;Holger Giese,Matthias Tichy,Sven Burmester,Stephan Flake;Towards the compositional verification of real-time UML designs.;38-47;10;Requirements engineering and design;
2003;Don S. Batory,Jia Liu,Jacob Neal Sarvela;Refinements and multi-dimensional separation of concerns.;48-57;10;Requirements engineering and design;
2003;Petri Selonen,Jianli Xu;Validating UML models against architectural profiles.;58-67;10;Software architectures, patterns, and frameworks;
2003;Luciano Baresi,Reiko Heckel,Sebastian Thone,Daniel Varro;Modeling and validation of service-oriented architectures: application vs. style.;68-77;10;Software architectures, patterns, and frameworks;
2003;Jeremy S. Bradbury,Jurgen Dingel;Evaluating and improving the automatic analysis of implicit invocation systems.;78-87;10;Software architectures, patterns, and frameworks;
2003;Giovanni Vigna,Fredrik Valeur,Richard A. Kemmerer;Designing and implementing a family of intrusion detection systems.;88-97;10;Software architectures, patterns, and frameworks;
2003;Gregory M. Kapfhammer,Mary Lou Soffa;A family of test adequacy criteria for database-driven applications.;98-107;10;Testing and test tools;
2003;Nguyen Tran Sy,Yves Deville;Consistency techniques for interprocedural test data generation.;108-117;10;Testing and test tools;
2003;Atif M. Memon,Mary Lou Soffa;Regression testing of GUIs.;118-127;10;Testing and test tools;
2003;Alessandro Orso,Taweesup Apiwattanapong,Mary Jean Harrold;Leveraging field data for impact analysis and regression testing.;128-137;10;Testing and test tools;
2003;James D. Herbsleb,Audris Mockus;Formulation and preliminary test of an empirical theory of coordination in software engineering.;138-137;0;Software process and workflow;
2003;Tore Dyba;Factors of software process improvement success in small and large organizations: an empirical study in the scandinavian context.;148-157;10;Software process and workflow;
2003;Joao W. Cangussu,Raymond A. DeCarlo,Aditya P. Mathur;Monitoring the software test process using statistical process control: a logarithmic approach.;158-167;10;Software process and workflow;
2003;Matthias M. Muller,Frank Padberg;On the economic evaluation of XP projects.;168-177;10;Software process and workflow;
2003;Jens Krinke;Context-sensitive slicing of concurrent programs.;178-187;10;Validation and verification;
