2003;Oksana Tkachuk,Matthew B. Dwyer;Adapting side effects analysis for modular program model checking.;188-197;10;Validation and verification;
2003;Dennis Brylow,Jens Palsberg;Deadline analysis of interrupt-driven software.;198-207;10;Validation and verification;
2003;Claus Pahl,Michael Casey;Ontology support for web service processes.;208-216;9;Validation and verification;
2003;Jukka Viljamaa;Reverse engineering framework reuse interfaces.;217-226;10;Software reuse and evolution;
2003;Dirk Ohst,Michael Welle,Udo Kelter;Differences between versions of UML diagrams.;227-236;10;Software reuse and evolution;
2003;Stanislaw Jarzabek,Shubiao Li;"Eliminating redundancies with a ""composition with adaptation"" meta-programming technique.";237-246;10;Software analysis and model checking;
2003;Yung-Pin Cheng,Michal Young,Che-Ling Huang,Chia-Yi Pan;Towards scalable compositional analysis by refactoring design models.;247-256;10;Software analysis and model checking;
2003;Dimitra Giannakopoulou,Jeff N. Magee;Fluent model checking for event-based systems.;257-266;10;Software analysis and model checking;
2003;Robby,Matthew B. Dwyer,John Hatcliff;Bogor: an extensible and highly-modular software model checking framework.;267-276;10;Software analysis and model checking;
2003;Fei Xie,James C. Browne;Verified systems by composition from verified components.;277-286;10;Component-based software engineering;
2003;Stephen McCamant,Michael D. Ernst;Predicting problems caused by component upgrades.;287-296;10;Component-based software engineering;
2003;Hridesh Rajan,Kevin J. Sullivan;Eos: instance-level aspects for integrated system design.;291-306;16;Component-based software engineering;
2003;Suan Hsi Yong,Susan Horwitz;Protecting C programs from attacks via invalid pointer dereferences.;307-316;10;Safety and security;
2003;V. Benjamin Livshits,Monica S. Lam;Tracking pointers with path and context sensitivity for bug detection in C programs.;317-326;10;Safety and security;
2003;Yichen Xie,Andy Chou,Dawson R. Engler;ARCHER: using symbolic, path-sensitive analysis to detect memory access errors.;327-336;10;Safety and security;
2003;Koushik Sen,Grigore Rosu,Gul Agha;Runtime safety analysis of multithreaded programs.;337-346;10;Safety and security;
2003;Nikunj R. Mehta,Nenad Medvidovic;Composing architectural styles from architectural primitives.;347-350;4;Poster Session;
2003;Kleanthis Thramboulidis;Towards an engineering tool for implementing reusable distributed control systems.;351-354;4;Poster Session;
2003;Antonia Bertolino,Stefania Gnesi;Use case-based testing of product lines.;355-358;4;Poster Session;
2003;Rik Eshuis,Pierre Brimont,Eric Dubois 0001,Bertrand Gregoire,Sophie Ramel;EFFICIENT: a tool set for supporting the modelling and validation of ebXML.;359-362;4;Poster Session;
2003;Simonetta Balsamo,Moreno Marzolla;A simulation-based approach to software performance modeling.;363-366;4;Poster Session;
2003;Alexander Ran,Raimondas Lencevicius;Making sense of runtime architecture for mobile phone software.;367-370;4;Poster Session;
2003;Eunyoung Lee,Andrew W. Appel;Policy-enforced linking of untrusted components.;371-374;4;Poster Session;
2003;Paulo Asterio de Castro Guerra,Cecilia Mary Fischer Rubira,Alexander Romanovsky,Rogerio de Lemos;A fault-tolerant software architecture for COTS-based software systems.;375-378;4;Poster Session;
2003;Richard S. Hall,Humberto Cervantes;Gravity: supporting dynamically available services in client-side applications.;379-382;4;Poster Session;
2002;Andreas Zeller;Isolating cause-effect chains from computer programs.;1-10;10;Dynamic program analysis;
2002;Jeremy W. Nimmer,Michael D. Ernst;Invariant inference for static checking.;11-20;10;Dynamic program analysis;
2002;Christine Julien,Gruia-Catalin Roman;Egocentric context-aware programming in ad hoc mobile environments.;21-30;10;Mobility;
2002;Licia Capra,Wolfgang Emmerich,Cecilia Mascolo;A micro-economic approach to conflict resolution in mobile computing.;31-40;10;Mobility;
2002;Antonia Lopes,Jose Luiz Fiadeiro,Michel Wermelinger;Architectural primitives for distribution and mobility.;41-50;10;Mobility;
2002;Yichen Xie,Dawson R. Engler;Using redundancies to find errors.;51-60;10;Static program analysis;
2002;Glenn Bruns,Satish Chandra;Searching for points-to analysis.;61-70;10;Static program analysis;
2002;Markus Mock,Darren C. Atkinson,Craig Chambers,Susan J. Eggers;Improving program slicing with dynamic points-to data.;71-80;10;Static program analysis;
2002;Gerard J. Holzmann;The logic of bugs.;81-87;7;Award ceremony and keynote;
2002;Harry C. Li,Shriram Krishnamurthi,Kathi Fisler;Verifying cross-cutting features as open systems.;89-98;10;Aspect-oriented programming;
2002;Mark Chu-Carroll,James L. Wright,David Shields;Supporting aggregation in fine grained software configuration management.;99-108;10;Aspect-oriented programming;
2002;Sebastian Uchitel,Jeffrey Kramer,Jeff N. Magee;Negative scenarios for implied scenario elicitation.;109-118;10;Requirements analysis;
2002;Emmanuel Letier,Axel van Lamsweerde;Deriving operational software specifications from system goals.;119-128;10;Requirements analysis;
2002;Monika Vetterling,Guido Wimmel,Alexander K. Wisspeintner;Secure systems development based on the common criteria: the PalME project.;129-138;10;Requirements analysis;
2002;Arie Gurfinkel,Benet Devereux,Marsha Chechik;Model exploration with temporal logic query checking.;139-148;10;Modelling;
2002;Jianwei Niu,Joanne M. Atlee,Nancy A. Day;Composable semantics for model-based notations.;149-158;10;Modelling;
2002;Jamieson M. Cobleigh,Leon J. Osterweil,Alexander E. Wise,Barbara Staudt Lerner;Containment units: a hierarchically composable architecture for adaptive systems.;159-165;7;Dynamic response systems;
2002;Bikram Sengupta,Rance Cleaveland;Triggered message sequence charts.;167-176;10;Dynamic response systems;
2001;Andre van der Hoek,Marija Mikic-Rakic,Roshanak Roshandel,Nenad Medvidovic;Taming architectural evolution.;1-10;10;Architecture;
2001;Yoshitomi Morisawa,Koji Torii;An architectural style of product lines for distributed processing systems, and practical selection method.;11-20;10;Architecture;
2001;Michel Wermelinger,Antonia Lopes,Jose Luiz Fiadeiro;A graph based architectural (Re)configuration language.;21-32;12;Architecture;
2001;Timothy J. Sliski,Matthew P. Billmers,Lori A. Clarke,Leon J. Osterweil;An architecture for flexible, evolvable process-driven user-guidance environments.;33-43;11;Architecture;
2001;Nima Kaveh,Wolfgang Emmerich;Deadlock detection in distribution object systems.;44-51;8;Distributed systems;
2001;Ramesh Jagannathan,Paolo A. G. Sivilotti;Increasing client-side confidence in remote component implementations.;52-61;10;Distributed systems;
2001;Daniel Jackson,Ilya Shlyakhter,Manu Sridharan;A micromodularity mechanism.;62-73;12;Specification;
2001;Sebastian Uchitel,Jeffrey Kramer,Jeff N. Magee;Detecting implied scenarios in message sequence chart specifications.;74-82;9;Specification;
2001;Peter Wendorff;A formal approach to the assessment and improvement of terminological models used in information systems engineering.;83-87;5;Specification;
2001;Yvonne Coady,Gregor Kiczales,Mike Feeley,Greg Smolyn;Using aspectC to improve the modularity of path-specific customization in operating system code.;88-98;11;Modularity;
2001;Kevin J. Sullivan,William G. Griswold,Yuanfang Cai,Ben Hallen;The structure and value of modularity in software design.;99-108;10;Modularity;
2001;Luca de Alfaro,Thomas A. Henzinger;Interface automata.;109-120;12;Component composition;
2001;Paola Inverardi,Massimo Tivoli;Automatic synthesis of deadlock free connectors for COM/DCOM applications.;121-131;11;Component composition;
2001;Leigh A. Davis,Rose F. Gamble,Jamie Payton,Gerdur Jonsdottir,Dennis J. Underwood;A notation for problematic architecture interactions.;132-141;10;Component composition;
2001;Alberto Coen-Porisini,Giovanni Denaro,Carlo Ghezzi,Mauro Pezze;Using symbolic execution for verifying safety-critical systems.;142-151;10;Verification;
2001;Kathi Fisler,Shriram Krishnamurthi;Modular verification of collaboration-based software designs.;152-163;12;Verification;
2001;Yunja Choi,Sanjai Rayadurgam,Mats Per Erik Heimdahl;Automatic abstraction for model checking software systems with interrelated numeric constraints.;164-174;11;Verification;
2001;Norman Ramsey,Elod Csirmaz;An algebraic approach to file synchronization.;175-185;11;Verification;
2001;Gregor Engels,Jochen Malte Kuster,Reiko Heckel,Luuk Groenewegen;A methodology for specifying and analyzing consistency of object-oriented behavioral models.;186-195;10;Real time UML;
2001;Luigi Lavazza,Gabriele Quaroni,Matteo Venturelli;Combining UML and formal notations for modelling real-time systems.;196-206;11;Real time UML;
2001;Chris Luer,David S. Rosenblum;WREN---an environment for component-based development.;207-217;11;Components;
2001;Jens H. Weber-Jahnke;Engineering component-based net-centric systems for embedded applications.;218-228;11;Components;
2001;Robert Bruce Findler,Mario Latendresse,Matthias Felleisen;Behavioral contracts and behavioral subtyping.;229-236;8;Components;
2001;Jon Edvardsson,Mariam Kamkar;Analysis of the constraint solver in UNA based test data generation.;237-245;9;Testing;
2001;William Dickinson,David Leon,Andy Podgurski;Pursuing failure: the distribution of program failures in a profile space.;246-255;10;Testing;
2001;Atif M. Memon,Mary Lou Soffa,Martha E. Pollack;Coverage criteria for GUI testing.;256-267;12;Testing;
2001;Reidar Conradi,Tore Dyba;An empirical study on the utility of formal routines to transfer knowledge and experience.;268-276;9;Experiences and case studies;
2001;Bernd G. Freimut,Susanne Hartkopf,Peter Kaiser,Jyrki Kontio,Werner Kobitzsch;An industrial case study of implementing software risk management.;277-287;11;Experiences and case studies;
2001;Forrest Shull,Jeffrey Carver,Guilherme Travassos;An empirical methodology for introducing software processes.;288-296;9;Experiences and case studies;
2001;Premysl Brada;Component revision identification based on IDL/ADL component specification.;297-298;2;Poster Presentations;
2001;Jacky Estublier,Herve Verjus,Pierre-Yves Cunin;Modelling and managing software federations.;299-300;2;Poster Presentations;
2001;Duncan Clarke,Thierry Jeron,Vlad Rusu,Elena Zinovieva;STG: a tool for generating symbolic test programs and oracles from operational specifications.;301-302;2;Poster Presentations;
2001;David A. Basin,Frank Rittinger,Luca Vigano;A formal data-model of the CORBA security service.;303-304;2;Poster Presentations;
2001;Vugranam C. Sreedhar;York: programming software components.;305-306;2;Poster Presentations;
2001;Vincenzo Ambriola,R. Mark Greenwood;8th European workshop on software process technology: report and future directions.;307-308;2;EWSPT Report;
2001;Robert L. Nord,Daniel J. Paulish,Robert W. Schwanke,Dilip Soni;Software architecture in a changing world: developing design strategies that anticipate change.;309-310;2;Full-day Tutorials;
2001;Wolfgang Emmerich,Nima Kaveh;Component technologies: Java Beans, COM, CORBA, RMI, EJB and the CORBA Component Model.;311-312;2;Full-day Tutorials;
2001;Gregor Kiczales,Erik Hilsdale;Aspect-oriented programming.;313;1;Full-day Tutorials;
2001;Kurt C. Wallnau,Scott A. Hissam,Robert C. Seacord;Half day tutorial in methods of component-based software engineering essential concepts and classroom experience.;314-315;2;Half-day Tutorials;
2001;Martin Lippert,Stefan Roock;Adapting XP to complex application domains.;316-317;2;Half-day Tutorials;
2001;Engin Kirda;Engineering of Web services with XML and XSL.;318-319;2;Half-day Tutorials;
2001;Paul Grunbacher,Barry W. Boehm;EasyWinWin: a groupware-supported methodology for requirements negotiation.;320-321;2;Half-day Tutorials;
2001;Mike Mannion,Hermann Kaindl;Requirements-based product line engineering.;322-323;2;Half-day Tutorials;
2001;Albert Zundorf;From use cases to code---rigorous software development with UML.;324-325;2;Half-day Tutorials;
2001;Karl Aberer,Manfred Hauswirth;Peer-to-peer information systems: concepts and models, state-of-the-art, and future systems.;326-327;2;Half-day Tutorials;
2001;Alexander Ran;Fundamental concepts for practical software architecture.;328-329;2;Half-day Tutorials;
2000;Richard A. DeMillo;Software development for next generation communication networks.;1;1;;
2000;Martin P. Robillard,Gail C. Murphy;Designing robust Java programs with exceptions.;2-10;9;;
2000;Joseph E. Hollingsworth,Lori Blankenship,Bruce W. Weide;Experience report: using RESOLVE/C++ for commercial software.;11-19;9;;
2000;Reimer Behrends,R. E. Kurt Stirewalt;The universe model: an approach for improving the modularity and reliability of concurrent programs.;20-29;10;;
2000;Atif M. Memon,Martha E. Pollack,Mary Lou Soffa;Automated test oracles for GUIs.;30-39;10;;
2000;Patrice Godefroid,Lalita Jategaonkar Jagadeesan,Radha Jagadeesan,Konstantin Laufer;Automated systematic testing for constraint-based interactive services.;40-49;10;;
2000;Sergey Butkevich,Marco Renedo,Gerald Baumgartner,Michal Young;Compiler and tool support for debugging object protocols.;50-59;10;;
2000;Yunwen Ye,Gerhard Fischer,Brent Reeves;Integrating active information delivery and reuse repository systems.;60-68;9;;
2000;Robert J. Walker,Gail C. Murphy;Implicit context: easing software evolution and reuse.;69-78;10;;
2000;Richard D. Pethia;Bugs in the programs.;79;1;;
2000;Tetsuo Yamamoto,Makoto Matsushita,Katsuro Inoue;Accumulative versioning file system Moraine and its application to metrics environment MAME.;80-87;8;;
2000;Mark Chu-Carroll,Sara Sprenkle;Coven: brewing better collaboration through software configuration management.;88-97;10;;
2000;Peter F. Sweeney,Frank Tip;Extracting library-based object-oriented applications.;98-107;10;;
2000;Leon J. Osterweil,Lori A. Clarke,Michael Evangelist,Jeffrey Kramer,H. Dieter Rombach,Alexander L. Wolf;The impact project: determining the impact of software engineering research upon practice (panel session).;108-109;2;;
2000;Jonathan D. Hay,Joanne M. Atlee;Composing features and resolving interactions.;110-119;10;;
2000;Gerald Luttgen,Michael von der Beeck,Rance Cleaveland;A compositional approach to statecharts semantics.;120-129;10;;
2000;Daniel Jackson;Automating first-order relational logic.;130-139;10;;
2000;Marco Bernardo,Paolo Ciancarini,Lorenzo Donatiello;On the formalization of architectural types with process algebras.;140-148;9;;
2000;Daniel Jackson,Kevin J. Sullivan;COM revisited: tool-assisted modelling of an architectural framework.;149-158;10;;
2000;Gleb Naumovich,Lori A. Clarke;Classifying properties: an alternative to the safety-liveness classification.;159-168;10;;
2000;Richard F. Rashid;The shape of things to come?;169;1;;
1999;Kent Beck;Extreme Programming: A Discipline of Software Development.;1;1;Invited Papers;
1999;Krzysztof Czarnecki,Ulrich W. Eisenecker;Components and Generative Programming.;2-19;18;Invited Papers;
1999;Manfred Hauswirth,Mehdi Jazayeri;A Component and Communication Model for Push Systems.;20-38;19;Software Components;
1999;Cecilia Mascolo,Gian Pietro Picco,Gruia-Catalin Roman;A Fine-Grained Model for Code Mobility.;39-56;18;Software Components;
1999;Vered Gafni;Robots: A Real-Time Systems Architectural Style.;57-74;18;Software Components;
1999;Brian Warboys,Dharini Balasubramaniam,R. Mark Greenwood,Graham N. C. Kirby,Kenneth R. Mayes,Ronald Morrison,David S. Munro;Collaboration and Composition: Issues for a Second Generation Process Language.;75-90;16;Software Process;
1999;Dirk Jager,Ansgar Schleicher,Bernhard Westfechtel;Using UML for Software Process Modeling.;91-108;18;Software Process;
1999;Frank Padberg;A Probabilistic Model for Software Projects.;109-126;18;Software Process;
1999;Nancy G. Leveson,Mats Per Erik Heimdahl,Jon Damon Reese;Designing Specification Languages for Process Control Systems: Lessons Learned and Steps to the Future.;127-145;19;Specification;
1999;Angelo Gargantini,Constance L. Heitmeyer;Using Model Checking to Generate Tests from Requirements Specifications.;146-162;17;Specification;
1999;Jeffrey M. Thompson,Mats Per Erik Heimdahl,Steven P. Miller;Specification-Based Prototyping for Embedded Systems.;163-179;17;Specification;
1999;Michael Siff,Satish Chandra,Thomas Ball,Krishna Kunchithapadam,Thomas W. Reps;Coping with Type Casts in C.;180-198;19;Program Analysis;
1999;Donglin Liang,Mary Jean Harrold;Efficient Points-to Analysis for Whole-Program Analysis.;199-215;17;Program Analysis;
1999;Thomas Ball;The Concept of Dynamic Analysis.;216-234;19;Program Analysis;
1999;Atanas Rountev,Barbara G. Ryder,William Landi;Data-Flow Analysis of Program Fragments.;235-252;18;Program Analysis;
1999;Andreas Zeller;Yesterday, My Program Worked. Today, It Does Not. Why?;253-267;15;Testing and Debugging;
1999;Clara Jaramillo,Rajiv Gupta,Mary Lou Soffa;Comparison Checking: An Approach to Avoid Debugging of Optimized Code.;268-284;17;Testing and Debugging;
1999;Juei Chang,Debra J. Richardson;Structural Specification-Based Testing: Automated Support and Experimental Evaluation.;285-302;18;Testing and Debugging;
1999;Tibor Gyimothy,Arpad Beszedes,Istvan Forgacs;An Efficient Relevant Slicing Method for Debugging.;303-321;19;Testing and Debugging;
1999;Martin P. Robillard,Gail C. Murphy;Analyzing Exception Flow in Java Programs.;322-327;6;Java;
1999;Gleb Naumovich,George S. Avrunin,Lori A. Clarke;An Efficient Algorithm for Computing MHP Information for Concurrent Java Programs.;338-354;17;Java;
1999;Boris Bokowski;CoffeeStrainer: Statically-Checked Constraints on the Definition and Use of Types in Java.;355-374;20;Java;
1999;Hugo Fierz;The CIP Method: Component- and Model-Based Construction of Embedded Systems.;375-392;18;Architecture and Models;
1999;Michel Wermelinger,Jose Luiz Fiadeiro;Algebraic Software Architecture Reconfiguration.;393-409;17;Architecture and Models;
1999;Pascal Fradet,Daniel Le Metayer,Michael Perin;Consistency Checking for Multiple View Software Architectures.;410-428;19;Architecture and Models;
1999;Stanislaw Jarzabek,Peter Knauber;Synergy between Component-Based and Generative Approaches.;429-445;17;Reuse;
1999;Joachim Bayer,Jean-Francois Girard,Martin Wurthner,Jean-Marc DeBaud,Martin Apel;Transitioning Legacy Assets to a Product Line Architecture.;446-463;18;Reuse;
1999;Stephen E. Dossick,Gail E. Kaiser;CHIME: A Metadata-Based Distributed Software Development Environment.;464-475;12;Reuse;
1999;Gilles Grimaud,Jean-Louis Lanet,Jean-Jacques Vandewalle;FACADE: A Typed Intermediate Language Dedicated to Smart Cards.;476-493;18;Verification and Checking;
1999;Victor A. Braberman,Miguel Felder;Verification of Real-Time Designs: Combining Scheduling Theory with Automatic Formal Verification.;494-510;17;Verification and Checking;
1999;Dimitra Giannakopoulou,Jeff N. Magee,Jeffrey Kramer;Checking Progress with Action Priority: Is it Fair?;511-527;17;Verification and Checking;
1998;Mark Astley,Gul Agha;Customizaton and Compositon of Distributed Objects: Middleware Abstractions for Policy Management.;1-9;9;;
1998;Jochen Seemann,Jurgen Wolff von Gudenberg;Pattern-Based Design Recovery of Java Software.;10-16;7;;
1998;Perdita Stevens,Rob Pooley;Systems Reengineering Patterns.;17-23;7;;
1998;Gleb Naumovich,George S. Avrunin;A Conservative Data Flow Algorithm for Detecting All Pairs of Statement That May Happen in Parallel.;24-34;11;;
1998;Jonathan E. Cook,Alexander L. Wolf;Event-Base Detection of Concurrency.;35-45;11;;
1998;Darren C. Atkinson,William G. Griswold;Effective Whole-Program Analysis in the Presence of Pointers.;46-55;10;;
1998;Ralph D. Jeffords,Constance L. Heitmeyer;Automatic Generation of State Invariants from Requirements Specifications.;56-69;14;;
1998;Robert Allen,David Garlan;Formal Modeling and Analysis of the HLA Component Integration Standard.;70-79;10;;
1998;Sylvia Stuurman,Jan van Katwijk;On-Line Change Mechanisms.;80-86;7;;
1998;Michael S. Mahony;Finding a History for Software Engineering.;87;1;;
1998;Shriram Krishnamurthi,Matthias Felleisen;Toward a Formal Theory of Extensible Software.;88-98;11;;
1998;Gregor Snelting,Frank Tip;Reengineering Class Hierarchies Using Concept Analysis.;99-110;12;;
1998;Gou Masuda,Norihiro Sakamoto,Kazuo Ushijima;Applying Design Patterns to Decision Tree Learning System.;111-120;10;;
1998;Daniel Jackson;An Intermedicate Design Language and Its Analysis.;121-130;10;;
1998;Michael Karasick;The Architecture of Montana: An Open and Extensible Programming Environment with an Incremental C++.;131-142;12;;
1998;Anne M. Disney,Philip M. Johnson;Investigation Data Quality Problems in the PSP.;143-152;10;;
1998;Phyllis G. Frankl,Oleg Iakounenko;Further Empirical Studies of Test Effectiveness.;153-162;10;;
1998;Jyrki Kontio,Gerhard Getto,Dieter Landes;Experiences in Improving Risk Management Processes Using the Concepts of the Riskit Method.;163-172;10;;
1998;Rajeev Alur,Mihalis Yannakakis;Model Checking of Hierarchical State Machines.;175-188;14;;
1998;Matthew B. Dwyer,Corina S. Pasareanu;Filter-Based Model Checking of Partial Systems.;189-202;14;;
1998;Martin L. Griss;Software Engineering as a Profession: Industry and Academia Working Together.;203-208;6;;
1998;David Garlan,Somesh Jha,David Notkin;Reasoning about Implicit Invocation.;209-221;13;;
1998;Philip W. L. Fong,Robert D. Cameron;Proof Linking: An Architecture for Modular Verification of Dynamically-Linked Mobile Code.;222-230;9;;
1998;Neelam Gupta,Aditya P. Mathur,Mary Lou Soffa;Automated Test Data Generation Using an Iterative Relaxation Method.;231-244;14;;
1997;David Lorge Parnas;Software Engineering: An Unconsummated Marriage (Extended Abstract).;1-3;3;Invited Papers;
1997;John M. Rushby;Subtypes for Specifications.;4-19;16;Invited Papers;
1997;Barry W. Boehm,Alexander Egyed,Julie Kwan,Raymond J. Madachy;Developing Multimedia Applications with the WinWin Spiral Model.;20-39;20;Invited Papers;
1997;Thomas Stephen Edward Maibaum;What We Teach Software Engineers in the University: Do We Take Engineering Seriously?;40-50;11;Software Engineering Education (Invited Presentations);
1997;Jurgen Uhl;What we Expect from Software Engineers in the Industry (Abstract).;51;1;Software Engineering Education (Invited Presentations);
1997;Richard A. Kemmerer;Security Issues in Distributed Software.;52-59;8;State-of-the-Art Report (Invited Presentation);
1997;Nenad Medvidovic,Richard N. Taylor;A Framework for Classifying and Comparing Architecture Description Languages.;60-76;17;Software Architecture;
1997;Gleb Naumovich,George S. Avrunin,Lori A. Clarke,Leon J. Osterweil;Applying Static Analysis to Software Architectures.;77-93;17;Software Architecture;
1997;Theo Dirk Meijler,Serge Demeyer,Robert Engel;Making Design Patterns Explicit in FACE: A Frame Work Adaptive Composition Environment.;94-110;17;Software Architecture;
1997;Graham Allen,Leighton Davies,Goran Lindmark,Even-Andre Karlsson;TTM15 - A Large Multi-Site Improvement Project.;111-124;14;Processes;
1997;Gregor Joeris;Change Management Needs Integrated Process and Configuration Management.;125-141;17;Processes;
1997;Stanley M. Sutton Jr.,Leon J. Osterweil;The Design of a Next-Generation Process Language.;142-158;17;Processes;
1997;Andre van der Hoek,Richard S. Hall,Dennis Heimbigner,Alexander L. Wolf;Software Release Management.;159-175;17;Configuration and Process Tools;
1997;Klaus Pohl,Klaus Weidenhaupt;A Contextual Approach for Process-Integrated Tools.;176-192;17;Configuration and Process Tools;
1997;Jens H. Weber-Jahnke,Wilhelm Schafer,Albert Zundorf;Generic Fuzzy Reasoning Nets as a Basis for Reverse Engineering Relational Database Applications.;193-210;18;Configuration and Process Tools;
1997;Andrea Alborghetti,Angelo Gargantini,Angelo Morzenti;Providing Automated Support to Deductive Analysis of Time Critical Systems.;211-226;16;Formal Analysis;
1997;Shing-Chi Cheung,Dimitra Giannakopoulou,Jeffrey Kramer;Verification of Liveness Properties Using Compositional Reachability Analysis.;227-243;17;Formal Analysis;
1997;Matthew B. Dwyer,Vicki Carr,Laura Hines;Model Checking Graphical User Interfaces Using Abstractions.;244-261;18;Formal Analysis;
1997;Murray Wood,Marc Roper,Andrew Brooks,James Miller;Comparing and Combining Software Defect Detection Techniques: A Replicated Empirical Study.;262-277;16;Empirical Studies;
1997;Christof Ebert;Experiences with Criticality Predictions in Software Development.;278-293;16;Empirical Studies;
1997;Lesley Pek Wee Land,Christopher Sauer,D. Ross Jeffery;Validating the Defect Detection Performance Advantage of Group Designs for Software Reviews: Report of a Laboratory Experiment Using Program Code.;294-309;16;Empirical Studies;
1997;Jules Desharnais,Marc Frappier,Ridha Khedri,Ali Mili;Integration of Sequential Scenarios.;310-326;17;System Modeling;
1997;Gregor Engels,Reiko Heckel,Gabriele Taentzer,Hartmut Ehrig;A View-Oriented Approach to System Modelling Based on Graph Transformation.;327-343;17;System Modeling;
1997;David S. Rosenblum,Alexander L. Wolf;A Design Framework for Internet-Scale Event Observation and Notification.;344-360;17;System Modeling;
1997;Rastislav Bodik,Rajiv Gupta,Mary Lou Soffa;Refining Data Flow Information Using Infeasible Paths.;361-377;17;Testing;
1997;Istvan Forgacs,Antonia Bertolino;Feasible Test Path Selection by Principal Slicing.;378-394;17;Testing;
1997;Premkumar T. Devanbu,Stuart G. Stubblebine;Cryptographic Verification of Test Coverage Claims.;395-413;19;Testing;
1997;Yih-Farn Robin Chen,Emden R. Gansner,Eleftherios Koutsofios;A C++ Data Model Supporting Reachability Analysis and Dead Code Detection.;414-431;18;Program Analysis;
